<!ELEMENT employees (employee+)>
<!ELEMENT employee (name,age,department,role,salary)>

<!ELEMENT name (#PCDATA)>
<!ELEMENT age (#PCDATA)>
<!ELEMENT department (#PCDATA)>
<!ELEMENT role (#PCDATA)>
<!ELEMENT salary (#PCDATA)>